{"run":75,"commit":"4c04868","metric":3.74,"metrics":{"cov_branches":0,"cov_functions":0,"cov_lines":0,"cov_statements":0,"unit_s":2.77},"status":"discard","description":"vmThreads pool (webcrypto missing)","timestamp":1776723041266,"segment":4,"confidence":6.391304347826074,"iterationTokens":5868,"asi":{"hypothesis":"vmThreads pool","rollback_reason":"vmThreads runs in vm.Context which lacks crypto.subtle/webcrypto in node 24 — hashUserId tests fail."}}
{"run":76,"commit":"4c04868","metric":4.33,"metrics":{"cov_branches":92.55,"cov_functions":98.16,"cov_lines":99.33,"cov_statements":98.26,"unit_s":3.18},"status":"discard","description":"Drop coverage html+json reporters (no win)","timestamp":1776723064245,"segment":4,"confidence":8.166666666666657,"iterationTokens":2023,"asi":{"hypothesis":"Drop html coverage reporter to skip file IO","rollback_reason":"Within noise (4.33 vs 4.12 best). HTML report is useful for dev inspection — not worth losing."}}
{"run":77,"commit":"4c04868","metric":5.11,"metrics":{"cov_branches":92.55,"cov_functions":98.16,"cov_lines":99.33,"cov_statements":98.26,"unit_s":4.25},"status":"discard","description":"minWorkers=maxWorkers=8 (worse)","timestamp":1776723090203,"segment":4,"confidence":7,"iterationTokens":1739,"asi":{"hypothesis":"Force 8 workers","rollback_reason":"Worse than default heuristic. Default pool sizing already optimal."}}
{"run":78,"commit":"4c04868","metric":4.44,"metrics":{"cov_branches":92.55,"cov_functions":98.16,"cov_lines":99.33,"cov_statements":98.26,"unit_s":3.38},"status":"discard","description":"maxWorkers=100% (worse)","timestamp":1776723188067,"segment":4,"confidence":7.538461538461544,"iterationTokens":8746,"asi":{"hypothesis":"maxWorkers=100% (16 threads)","rollback_reason":"4.44 vs 4.12 best — worse. Default heuristic (50%) is better."}}
{"run":79,"commit":"4c04868","metric":4.83,"metrics":{"cov_branches":92.55,"cov_functions":98.16,"cov_lines":99.33,"cov_statements":98.26,"unit_s":3.72},"status":"discard","description":"Noise check: re-run current HEAD","timestamp":1776723207733,"segment":4,"confidence":4.741935483870973,"iterationTokens":1324,"asi":{"finding":"Re-running same code: 4.83 vs 4.12 best. Noise is significant (~0.7s wall variation).","hypothesis":"Re-baseline / noise check"}}
{"run":80,"commit":"4c04868","metric":4.34,"metrics":{"cov_branches":92.55,"cov_functions":98.16,"cov_lines":99.33,"cov_statements":98.26,"unit_s":3.3},"status":"discard","description":"Median of 3 runs at HEAD: 4.34s (true baseline)","timestamp":1776723253107,"segment":4,"confidence":7.3500000000000085,"iterationTokens":1870,"asi":{"finding":"Median of 3 runs at HEAD: 4.34s. Earlier 4.12 was lucky run. Real median improvement vs 5.59 baseline = ~22%.","hypothesis":"Stability check: 3 consecutive runs","measurements":"4.32, 4.41, 4.34","median_s":4.34}}
{"run":81,"commit":"4c04868","metric":4.42,"metrics":{"cov_branches":92.55,"cov_functions":98.16,"cov_lines":99.33,"cov_statements":98.26,"unit_s":3.3},"status":"discard","description":"--reporter=dot (no win)","timestamp":1776723371737,"segment":4,"confidence":8.647058823529415,"iterationTokens":20644,"asi":{"hypothesis":"--reporter=dot to skip default reporter overhead","measurements":"4.33, 4.42, 5.03","rollback_reason":"No measurable improvement (median 4.42 vs 4.34) and loses per-file timing in default output."}}
{"run":82,"commit":"4eabbee","metric":4.16,"metrics":{"cov_branches":92.55,"cov_functions":98.16,"cov_lines":99.33,"cov_statements":98.26,"unit_s":3.3},"status":"keep","description":"coverage.skipFull=true (less reporter rendering)","timestamp":1776723466915,"segment":4,"confidence":8.400000000000007,"iterationTokens":6998,"asi":{"hypothesis":"skipFull: hide files at 100% coverage from text report (less rendering)","measurements":"4.16, 4.13, 4.50","median_s":4.16,"note":"Improvement is small but reproducible across 2 of 3 runs."}}
{"run":83,"commit":"4eabbee","metric":4.11,"metrics":{"cov_branches":92.55,"cov_functions":98.16,"cov_lines":99.33,"cov_statements":98.26,"unit_s":3.3},"status":"keep","description":"Split search-command-dialog.test.tsx into 2 files (30 + 24 tests)","timestamp":1776723606277,"segment":4,"confidence":8.222222222222232,"iterationTokens":10834,"asi":{"approach":"Split tests/components/search-command-dialog.test.tsx (longest file at 2.05s) into two files: original (rendering/click/folder/copy/dialog state/search filtering/tag badge rendering/copy button — 30 tests) and ...-search.test.tsx (search edge cases/tag edge cases/keyword highlighting/ideas search — 24 tests). Together both run in 1.3s.","hypothesis":"Split the longest test file into 2 to reduce single-worker bottleneck","measurements":"4.11, 4.04, 4.47","median_s":4.11,"tests_total":54}}
{"run":84,"commit":"4592f88","metric":4.3,"metrics":{"cov_branches":92.55,"cov_functions":98.16,"cov_lines":99.33,"cov_statements":98.26,"unit_s":3.3},"status":"keep","description":"d1-client retry tests use vi.useFakeTimers (no more real backoff sleeps)","timestamp":1776723772126,"segment":4,"confidence":9.24999999999999,"iterationTokens":12984,"asi":{"approach":"Use vi.useFakeTimers() + vi.runAllTimersAsync() in 3 retry tests in d1-client.test.ts. Drops file from 1025ms to 147ms (saves ~880ms intra-file).","hypothesis":"Use fake timers in d1-client retry tests to avoid wasting 600ms+200ms+200ms wall on real backoff delays","measurements_unit_cov_s":"4.26, 4.30, 4.58","median_unit_cov_s":4.3,"note":"Wall-clock impact is within noise because the file was not the longest; gains are absorbed by other parallel files. But this is a real UT-quality improvement: tests no longer waste 1s of real time on backoff sleeps.","tests_file_duration":"1025ms -> 147ms"}}
{"run":85,"commit":"4592f88","metric":4.55,"metrics":{"cov_branches":92.55,"cov_functions":98.16,"cov_lines":99.33,"cov_statements":98.26,"unit_s":3.3},"status":"discard","description":"Monkey-patch waitFor interval to 5ms (no win)","timestamp":1776724009558,"segment":4,"confidence":8.222222222222232,"iterationTokens":12844,"asi":{"finding":"waitFor polling isn't the bottleneck — the 50ms-per-test cost is React render + state update + microtask flush. waitFor's first poll fires synchronously and usually succeeds; lowering interval doesn't reduce the first-poll latency.","hypothesis":"Monkey-patch testing-library waitFor to use 5ms interval","median_unit_cov_s":4.55,"rollback_reason":"No improvement (worse: 4.55 vs 4.30 baseline). Confirms waitFor interval isn't the bottleneck for current tests."}}
{"run":86,"commit":"219accf","metric":4.21,"metrics":{"cov_branches":92.55,"cov_functions":98.16,"cov_lines":99.33,"cov_statements":98.26,"unit_s":3.3},"status":"keep","description":"Split inbox-triage.test.tsx into 2 files (28 + 15 tests)","timestamp":1776724136003,"segment":4,"confidence":9.24999999999999,"iterationTokens":11650,"asi":{"approach":"Split tests/components/inbox-triage.test.tsx (43 tests / 1.4s) at 'folder selector onChange' boundary into 28 tests (rendering/loading/empty/header/filtering/folder/note/save/tags/delete/error/refresh) + 15 tests (folder onChange/note onChange/save click/tag remove/tag picker/delete confirm/edit/LinkCard capabilities). Combined 1.10s vs 1.42s previously.","hypothesis":"Split inbox-triage.test.tsx (2nd-longest) for better worker scheduling","measurements":"4.46, 4.21, 4.19","median_unit_cov_s":4.21}}
{"run":87,"commit":"219accf","metric":5,"metrics":{"cov_branches":92.55,"cov_functions":98.16,"cov_lines":99.33,"cov_statements":98.26,"unit_s":3.3},"status":"discard","description":"Split links-list.test.tsx (no win, slight regression)","timestamp":1776724324087,"segment":4,"confidence":8.222222222222232,"iterationTokens":13431,"asi":{"hypothesis":"Split links-list.test.tsx into 2 (20 + 11 tests)","measurements":"5.10, 5.00, 4.30","median":5,"rollback_reason":"Median 5.0 vs prior 4.21. Wider variance. Splitting more files past the longest-bottleneck doesn't help wall — we've crossed a threshold where overhead per file > savings."}}
{"run":88,"commit":"219accf","metric":4.94,"metrics":{"cov_branches":92.55,"cov_functions":98.16,"cov_lines":99.33,"cov_statements":98.26,"unit_s":3.3},"status":"discard","description":"minWorkers=4 (worse)","timestamp":1776724371469,"segment":4,"confidence":7.589743589743594,"iterationTokens":1988,"asi":{"hypothesis":"minWorkers=4 to pre-warm pool","measurements":"4.94, 4.93, 5.29","median":4.94,"rollback_reason":"Worse (median 4.94 vs 4.21). Default heuristic is better."}}
{"run":89,"commit":"219accf","metric":4.72,"metrics":{"unit_s":3.74,"cov_lines":99.33,"cov_statements":98.26,"cov_branches":92.55,"cov_functions":98.16},"status":"discard","description":"Conditional jest-dom import (only in jsdom env)","timestamp":1776724740217,"segment":4,"confidence":5.692307692307695,"iterationTokens":619,"asi":{"hypothesis":"Skip jest-dom matchers import in node-env tests (44 jsdom + 51 node)","measurements":"4.94, 4.63, 4.72","median":4.72,"rollback_reason":"Median 4.72 vs 4.21 baseline. Setup wall went 8.07->5-6s but didn't translate to wall improvement (already amortized across workers).","next_action_hint":"Try moving the huge ~1700-line d1-client mock factory body into a sibling file imported lazily inside vi.mock factory. setup.ts is ~50KB which gets transformed for every file."}}
{"run":90,"commit":"219accf","metric":4.38,"metrics":{"cov_branches":92.55,"cov_functions":98.16,"cov_lines":99.33,"cov_statements":98.26,"unit_s":3.66},"status":"discard","description":"Extract d1 mock factory body to sibling file","timestamp":1776724846197,"segment":4,"confidence":6.883720930232546,"iterationTokens":619,"asi":{"hypothesis":"Move ~1600-line d1-client mock factory body out of setup.ts to sibling sibling for less per-file transform cost","measurements":"4.38, 4.75, 4.31","median":4.38,"next_action_hint":"Try server.deps.optimizer pre-bundling for heavy deps (react, testing-library, cmdk, radix). Or: skip d1 mock for tests that don't import it.","rollback_reason":"Median 4.38 vs 4.21 baseline. Transform is cached so setup.ts size doesn't matter much. Refactor is cleaner but doesn't move wall."}}
{"run":91,"commit":"219accf","metric":6.56,"metrics":{"cov_branches":92.55,"cov_functions":98.16,"cov_lines":99.33,"cov_statements":98.26,"unit_s":5.29},"status":"discard","description":"deps.optimizer.web pre-bundle React + RTL + cmdk","timestamp":1776724912588,"segment":4,"confidence":5.692307692307695,"iterationTokens":4340,"asi":{"hypothesis":"Pre-bundle React/testing-library/cmdk via deps.optimizer.web","measurements":"5.42, 6.72, 6.56","median":6.56,"rollback_reason":"Significantly worse (median 6.56 vs 4.21). Optimizer likely runs per-worker or interferes with the inline transforms. Not the bottleneck."}}
{"run":92,"commit":"219accf","metric":4.53,"metrics":{"cov_branches":92.55,"cov_functions":98.16,"cov_lines":99.34,"cov_statements":98.28,"unit_s":3.75},"status":"discard","description":"@vitejs/plugin-react-swc instead of plugin-react","timestamp":1776724977129,"segment":4,"confidence":6.1666666666666705,"iterationTokens":3185,"asi":{"hypothesis":"Switch @vitejs/plugin-react -> @vitejs/plugin-react-swc for faster JSX transform","measurements":"4.44, 4.63, 4.53","median":4.53,"next_action_hint":"Try playing with vitest's transformer cache or removing unused vitest features","rollback_reason":"Median 4.53 vs 4.21. SWC plugin has startup overhead that exceeds savings on a small ~44-jsdom suite. Bun also installs a binary postinstall block."}}
{"run":93,"commit":"219accf","metric":4.24,"metrics":{"cov_branches":92.55,"cov_functions":98.16,"cov_lines":99.33,"cov_statements":98.26,"unit_s":3.31},"status":"discard","description":"coverage.processingConcurrency=8","timestamp":1776725087189,"segment":4,"confidence":7.047619047619047,"iterationTokens":9060,"asi":{"hypothesis":"coverage.processingConcurrency=8 to parallelize V8 coverage report processing","measurements":"4.34, 4.24, 4.09","median":4.24,"rollback_reason":"Within noise (4.24 vs 4.21 best). Coverage report processing isn't a bottleneck."}}
{"run":94,"commit":"219accf","metric":4.46,"metrics":{"cov_branches":92.55,"cov_functions":98.16,"cov_lines":99.33,"cov_statements":98.26,"unit_s":3.47},"status":"discard","description":"Split search-command-dialog.test.tsx into 2 files (filtering/tags/copy)","timestamp":1776725228815,"segment":4,"confidence":7.4000000000000075,"iterationTokens":11816,"asi":{"hypothesis":"Split search-command-dialog.test.tsx (1.67s) into 2 — extract search filtering/tags/copy describes","measurements":"4.93, 4.46, 4.32","median":4.46,"next_action_hint":"Per-file split has run out of marginal returns. Try waitFor microtask flush refactor on viewmodel tests, or vitest projects to split jsdom/node setup.","rollback_reason":"Within noise (4.46 vs 4.21 best). Splitting past the 4-largest-files threshold doesn't move wall — overhead per file > savings."}}
{"run":95,"commit":"219accf","metric":5.25,"metrics":{"cov_branches":92.55,"cov_functions":98.16,"cov_lines":99.33,"cov_statements":98.26,"unit_s":3.87},"status":"discard","description":"vi.mock @testing-library/dom to patch waitFor interval=5ms","timestamp":1776725398530,"segment":4,"confidence":6.727272727272733,"iterationTokens":14052,"asi":{"hypothesis":"vi.mock @testing-library/dom in setup.ts to lower waitFor default interval 50ms->5ms","measurements":"4.45, 5.25, 5.57","median":5.25,"next_action_hint":"vi.mock factory in setup runs per file and is heavy; would need to land in test files individually. Skip waitFor optimization for now.","rollback_reason":"Median 5.25 vs 4.21. vi.mock factory has significant per-file overhead that exceeds the per-test waitFor savings."}}
{"run":96,"commit":"219accf","metric":5.45,"metrics":{"cov_branches":92.55,"cov_functions":98.16,"cov_lines":99.33,"cov_statements":98.26,"unit_s":4.46},"status":"discard","description":"coverage.reporter=['text'] only (drop json+html)","timestamp":1776725464598,"segment":4,"confidence":5.9199999999999875,"iterationTokens":3360,"asi":{"hypothesis":"Drop html+json reporters from base config (keep text + bench-provided json-summary)","measurements":"4.72, 5.45, 6.14","median":5.45,"rollback_reason":"Worse / within noise. Reporters aren't the bottleneck."}}
{"run":97,"commit":"219accf","metric":4.71,"metrics":{"unit_s":3.7,"cov_lines":99.33,"cov_statements":98.26,"cov_branches":92.55,"cov_functions":98.16},"status":"discard","description":"Re-baseline at HEAD (5 trials)","timestamp":1776725537116,"segment":4,"confidence":5.481481481481488,"iterationTokens":1834,"asi":{"hypothesis":"Re-baseline at HEAD with 5 trials to characterize noise","measurements":"4.62, 4.68, 4.71, 4.97, 6.62","median":4.71,"next_action_hint":"Real wall is ~4.7s with high variance (P99=6.6). Earlier 4.11/4.21 'best' runs were lucky. Likely no <0.5s gain detectable without fixing noise source first.","noise_p99":6.62,"real_baseline_s":4.71,"rollback_reason":"Re-baseline only — nothing changed"}}
{"run":98,"commit":"390dc02","metric":4.66,"metrics":{"cov_branches":92.55,"cov_functions":98.16,"cov_lines":99.33,"cov_statements":98.26,"unit_s":3.62},"status":"keep","description":"Add { interval: 5 } to all waitFor calls (52 sites, 6 files)","timestamp":1776725699443,"segment":4,"confidence":5.919999999999998,"iterationTokens":1012,"asi":{"hypothesis":"Pass { interval: 5 } to all waitFor calls in viewmodel + component tests (52 call sites across 6 files) to bypass 50ms default poll interval","measurements":"4.55, 4.66, 4.83, 4.44, 5.04","median":4.66,"next_action_hint":"Wall barely moved (4.66 vs 4.71) because longest file (search-command-dialog 1.6s) wasn't bottlenecked on waitFor. Per-file gains are real but masked: ideas-viewmodel 1.36s—0.78s, etc. Could split or speed up search-command-dialog next.","per_file_wins":"ideas-viewmodel.test.ts: 1.36s -> 0.78s (-43%); webhook-viewmodel/overview-viewmodel similar","previous_note_was_wrong":"ideas.md claimed monkey-patching waitFor interval had 'no effect' — that was incorrect. Per-file timing definitively improves with interval=5."}}
{"run":99,"commit":"390dc02","metric":4.52,"metrics":{"cov_branches":92.55,"cov_functions":98.16,"cov_lines":99.33,"cov_statements":98.26,"unit_s":3.56},"status":"keep","description":"Replace userEvent.type with fireEvent.change in search-command-dialog tests","timestamp":1776725799954,"segment":4,"confidence":5.919999999999998,"iterationTokens":435,"asi":{"hypothesis":"Replace 47 userEvent.type() calls in search-command-dialog tests with fireEvent.change. cmdk's CommandInput uses onValueChange which fires from input change events.","measurements_5":"4.48, 4.51, 4.56, 4.58, 4.58","median_5":4.56,"current_run":4.52,"next_action_hint":"Could apply same userEvent.type → fireEvent.change to other heavy files (links-list, inbox-triage). Many should be safe.","per_file_wins":"search-command-dialog: 1.6s -> 0.5s tests; combined with sibling 1.0s -> 0.0s tests (renderHook overhead). 47 type() calls eliminated.","variance":"Tighter envelope (4.48-4.58 over 5 runs) vs previous (4.62-6.62)"}}
{"run":100,"commit":"86fd43c","metric":4.29,"metrics":{"cov_branches":92.55,"cov_functions":98.16,"cov_lines":99.33,"cov_statements":98.26,"unit_s":3.36},"status":"keep","description":"Replace remaining user.type calls (8 sites in 5 files) with fireEvent.change","timestamp":1776725923765,"segment":4,"confidence":6.577777777777773,"iterationTokens":368,"asi":{"current_run":4.15,"hypothesis":"Replace 8 user.type/userEvent.type calls in 5 component test files (link-card, inbox-triage, create-link-modal, shared-link-components) with fireEvent.change","measurements_5":"4.23, 4.25, 4.29, 4.33, 4.46","median_5":4.29,"next_action_hint":"Could try splitting links-list (1.2s, no user.type calls — different bottleneck) or look at sidebar.test.tsx","per_file_wins":"5 files combined: 1.10s wall; was probably ~2s before. Still link-card (1.2s) and inbox-triage-interactions (1.3s) on critical path."}}
{"run":101,"commit":"4c5a898","metric":4.09,"metrics":{"cov_branches":92.55,"cov_functions":98.16,"cov_lines":99.33,"cov_statements":98.26,"unit_s":4.28},"status":"keep","description":"Replace user.click/clear with fireEvent in 5 component test files (~60 sites)","timestamp":1776726104274,"segment":4,"confidence":6.521739130434771,"iterationTokens":351,"asi":{"current_run":4.7,"hypothesis":"Replace ~58 user.click + 2 user.clear calls with fireEvent.click/change in 5 component test files (links-list, link-card, inbox-triage*, create-link-modal). Removes userEvent.setup() overhead too.","measurements_5":"4.05, 4.08, 4.09, 4.20, 5.10","median_5":4.09,"next_action_hint":"Median fell to 4.09. Outlier of 5.10 + this run's 4.70 suggest occasional spikes (GC?). Run more trials or try minWorkers fix to tighten variance.","per_file_wins":"links-list 1.16s→0.97s; link-card 1.15s→0.77s; inbox-triage* similarly improved"}}
{"run":102,"commit":"4c5a898","metric":4.13,"metrics":{"cov_branches":92.55,"cov_functions":98.16,"cov_lines":99.33,"cov_statements":98.26,"unit_s":4.06},"status":"discard","description":"Replace user.click in backy-page (2 sites)","timestamp":1776726215292,"segment":4,"confidence":6,"iterationTokens":285,"asi":{"current_run":5.31,"hypothesis":"Replace 2 user.click in backy-page.test.tsx (kept shared-link-components which has async clipboard)","measurements_6":"4.01, 4.10, 4.10, 4.17, 4.57, 5.31","median_6":4.13,"rollback_reason":"Within noise vs 4.09 prev median. Only 2 click sites in a non-bottleneck file."}}
{"run":103,"commit":"5d176d8","metric":4.43,"metrics":{"cov_branches":92.55,"cov_functions":98.16,"cov_lines":99.33,"cov_statements":98.26,"unit_s":3.6},"status":"discard","description":"Split sidebar.test.tsx into sidebar + sidebar-systems","timestamp":1776726513064,"segment":4,"confidence":6.521739130434771,"iterationTokens":369,"asi":{"current_run":4.53,"hypothesis":"Split sidebar.test.tsx (876ms) at 'systems nav group' boundary into 2 files (40 + 20 tests)","measurements_6":"4.13, 4.26, 4.33, 4.53, 4.59, 4.61","median_6":4.43,"rollback_reason":"Worse vs 4.09 baseline. Sidebar wasn't the longest — splitting added per-file overhead with no gain. Variance also increased."}}
{"run":104,"commit":"5d176d8","metric":4.48,"metrics":{"cov_branches":92.55,"cov_functions":98.16,"cov_lines":99.33,"cov_statements":98.26,"unit_s":3.5},"status":"discard","description":"{ interval: 5 } on vi.waitFor in inbox-triage tests","timestamp":1776726580145,"segment":4,"confidence":6.666666666666664,"iterationTokens":2885,"asi":{"hypothesis":"Add { interval: 5 } to 3 vi.waitFor() calls in inbox-triage tests","measurements_3":"4.36, 4.48, 5.29","median":4.48,"rollback_reason":"Within noise. Only 3 sites — not enough leverage."}}
{"run":105,"commit":"5d176d8","metric":4.51,"metrics":{"cov_branches":92.55,"cov_functions":98.16,"cov_lines":99.33,"cov_statements":98.26,"unit_s":3.5},"status":"discard","description":"poolOptions.threads minThreads=6 maxThreads=8","timestamp":1776726639179,"segment":4,"confidence":6.8181818181818254,"iterationTokens":1455,"asi":{"hypothesis":"minThreads=6, maxThreads=8 pre-warm pool","measurements_5":"4.18, 4.19, 4.51, 4.52, 4.56","median":4.51,"rollback_reason":"Worse than default heuristic. Default minThreads=1 + dynamic scale-up is faster than pre-warming all 6."}}
