{"run":34,"commit":"e19a0d9","metric":77.45,"metrics":{"l2_s":15.7,"l3_failed":0,"l3_s":61.23,"worker_s":0.52},"status":"keep","description":"Playwright workers=2→3","timestamp":1776651234932,"segment":3,"confidence":4.569593147751605,"iterationTokens":4091,"asi":{"finding":"workers=3 cuts L3 from 78s to 61s (-21%) with 0 flakes/failures. Prior session's bad workers=3 result was confounded with earlier flake state. Confirming with second run recommended.","hypothesis":"With uploads.spec flake fixed and warmer dev compile, workers=3 may now be stable."}}
{"run":35,"commit":"72d1718","metric":76.77,"metrics":{"l2_s":16.25,"l3_failed":0,"l3_s":59.96,"worker_s":0.56},"status":"keep","description":"Confirm workers=3 stability (no code change)","timestamp":1776651328872,"segment":3,"confidence":2.538328530259366,"iterationTokens":1247,"asi":{"hypothesis":"Confirm workers=3 stability"}}
{"run":36,"commit":"9868938","metric":69.13,"metrics":{"l2_s":16.6,"l3_failed":0,"l3_s":52,"worker_s":0.53},"status":"keep","description":"Playwright workers=3→4","timestamp":1776651414061,"segment":3,"confidence":3.5649038461538445,"iterationTokens":1340,"asi":{"finding":"workers=4 cuts L3 60s→52s with all 113 passing.","hypothesis":"Try workers=4"}}
{"run":37,"commit":"9b76b03","metric":65.73,"metrics":{"l2_s":16.29,"l3_failed":0,"l3_s":48.92,"worker_s":0.52},"status":"keep","description":"Playwright workers=4→5","timestamp":1776651495361,"segment":3,"confidence":3.4152892561983474,"iterationTokens":1347,"asi":{"finding":"workers=5: 49s, all pass.","hypothesis":"Try workers=5"}}
{"run":38,"commit":"d2ad5e2","metric":61.33,"metrics":{"l2_s":16.6,"l3_failed":0,"l3_s":44.19,"worker_s":0.54},"status":"keep","description":"Playwright workers=5→6","timestamp":1776651572875,"segment":3,"confidence":3.3931159420289885,"iterationTokens":1327,"asi":{"finding":"workers=6: 44s.","hypothesis":"Try workers=6"}}
{"run":39,"commit":"3d9d8f9","metric":59.32,"metrics":{"l2_s":15.99,"l3_failed":0,"l3_s":42.84,"worker_s":0.49},"status":"keep","description":"Playwright workers=6→8","timestamp":1776651651370,"segment":3,"confidence":4.190021231422511,"iterationTokens":1323,"asi":{"finding":"workers=8: 43s. Diminishing returns. Bottleneck likely longest individual file (tags-create 18s; backy 14s)","hypothesis":"Try workers=8","next_action_hint":"Mark tags-create/backy as describe.parallel within file (independent tests with own slugs)."}}
{"run":40,"commit":"3d9d8f9","metric":51.51,"metrics":{"l2_s":9.36,"l3_failed":0,"l3_s":41.67,"worker_s":0.48},"status":"discard","description":"tags-create describe.parallel — L2 SIGTERM invalid run","timestamp":1776651758232,"segment":3,"confidence":4.7439903846153815,"iterationTokens":2687,"asi":{"finding":"L2 was killed early (SIGTERM) — bench result invalid for L2 portion. L3 ran fine (41.7s). Need to re-test.","hypothesis":"describe.parallel for tags-create's 4 independent tests","next_action_hint":"Investigate root cause — possibly external SIGTERM during long parallel L3 run, or PID conflict.","rollback_reason":"L2 truncated; cannot trust comparison."}}
{"run":41,"commit":"524d071","metric":60.31,"metrics":{"l2_s":16.53,"l3_failed":0,"l3_s":43.27,"worker_s":0.51},"status":"keep","description":"Confirm baseline after revert (workers=8)","timestamp":1776651831560,"segment":3,"confidence":4.523782234957022,"iterationTokens":4294,"asi":{"finding":"Re-baseline after revert. workers=8 stable at 60s.","hypothesis":"Confirm post-revert baseline"}}
{"run":42,"commit":"524d071","metric":61.29,"metrics":{"l2_s":17,"l3_failed":0,"l3_s":43.78,"worker_s":0.51},"status":"discard","description":"tags-create describe.parallel (no win)","timestamp":1776651915799,"segment":3,"confidence":6.1575663026521035,"iterationTokens":1434,"asi":{"finding":"Within noise. tags-create's 4 tests all do beforeEach (createLink) so individual tests are still expensive. With 8 workers already saturated by 16 specs, file-internal parallelism doesn't extract more.","hypothesis":"describe.parallel for tags-create's 4 independent tests","rollback_reason":"No measurable change (61s vs 60s baseline)."}}
{"run":43,"commit":"524d071","metric":60.67,"metrics":{"l2_s":17.35,"l3_failed":0,"l3_s":42.78,"worker_s":0.54},"status":"discard","description":"link-crud describe.parallel","timestamp":1776652022185,"segment":3,"confidence":8.046890927624878,"iterationTokens":6699,"asi":{"finding":"link-crud parallel: 42.8s same as 43.3s baseline (within noise). Tests within file already saturated by other workers. Move on.","hypothesis":"link-crud describe.parallel mode","rollback_reason":"No measurable gain."}}
{"run":44,"commit":"524d071","metric":59.07,"metrics":{"l2_s":15.82,"l3_failed":0,"l3_s":42.75,"worker_s":0.5},"status":"keep","description":"vitest L2 isolate=false","timestamp":1776652106655,"segment":3,"confidence":9.027272727272717,"iterationTokens":3721,"asi":{"finding":"Marginal improvement (60.31→59.07s, ~2%). isolate=false saves worker startup but L2 floor still bound by longest file.","hypothesis":"vitest pool isolate=false to skip worker fork per test file"}}
{"run":45,"commit":"fb82d99","metric":60.92,"metrics":{"l2_s":15.88,"l3_failed":0,"l3_s":44.55,"worker_s":0.49},"status":"discard","description":"Pre-warm dashboard subroutes via page.request.get (no win)","timestamp":1776652220072,"segment":3,"confidence":11.927927927927923,"iterationTokens":6232,"asi":{"finding":"Pre-warm via page.request.get only fetches HTML — does not trigger turbopack route compile (compile happens on first browser navigation). Need page.goto in setup to actually warm.","hypothesis":"Pre-warm dashboard subroutes during auth.setup","next_action_hint":"Use page.goto for each route to force compile.","rollback_reason":"No measurable gain (60.9 vs 59.1 baseline)."}}
{"run":46,"commit":"fb82d99","metric":62.39,"metrics":{"l2_s":16.95,"l3_failed":0,"l3_s":44.95,"worker_s":0.49},"status":"discard","description":"Pre-warm via page.goto serial (worse)","timestamp":1776652306037,"segment":3,"confidence":17.57522123893807,"iterationTokens":2707,"asi":{"finding":"Pre-warming serially during setup adds ~2s setup cost that wasn't hidden behind other work. Routes still re-compile per worker due to dev mode quirks. Maybe parallel goto better.","hypothesis":"Pre-warm with page.goto so turbopack actually compiles routes","rollback_reason":"Worse than baseline (62.4 vs 59.1)."}}
{"run":47,"commit":"fb82d99","metric":59.43,"metrics":{"l2_s":17.15,"l3_failed":0,"l3_s":41.74,"worker_s":0.54},"status":"discard","description":"tags-create parallel retry (no win)","timestamp":1776652444817,"segment":3,"confidence":18.780141843971617,"iterationTokens":3037,"asi":{"finding":"tags-create parallel: 41.7s vs 42.75s baseline. <1s gain on L3, total within noise. Limited because tags-create finishes before other long files (e.g., backy 14s) and parallelizing it doesn't shorten the critical path.","hypothesis":"tags-create describe.parallel (retry)","rollback_reason":"No measurable gain."}}
{"run":48,"commit":"fb82d99","metric":58.3,"metrics":{"l2_s":15.67,"l3_failed":0,"l3_s":42.12,"worker_s":0.51},"status":"keep","description":"Combine cleanup+seedUser into 1 D1 round trip","timestamp":1776652684729,"segment":3,"confidence":18.238738738738753,"iterationTokens":2778,"asi":{"finding":"L2 dropped slightly (16.13→15.67s); marginal but real for adding only one helper. Saves 1 D1 round trip per file beforeAll.","hypothesis":"Combine cleanupTestData+seedTestUser into one D1 round trip (resetAndSeedUser)"}}
{"run":49,"commit":"265c238","metric":59.47,"metrics":{"l2_s":16.18,"l3_failed":0,"l3_s":42.82,"worker_s":0.47},"status":"keep","description":"Cleanup unused seedTestUser imports + fix vitest 4 config shape","timestamp":1776652800396,"segment":3,"confidence":21.198952879581114,"iterationTokens":6210,"asi":{"finding":"Cleanup imports + fix vitest config: total 59.5s (within noise of 58.3 last run). All tests pass and typecheck clean.","hypothesis":"Cleanup unused imports + fix vitest config (vitest 4 uses top-level isolate)"}}
{"run":50,"commit":"265c238","metric":66.91,"metrics":{"l2_s":15.57,"l3_failed":6,"l3_s":50.84,"worker_s":0.5},"status":"discard","description":"fullyParallel:true (breaks serial specs)","timestamp":1776652897880,"segment":3,"confidence":18.238738738738753,"iterationTokens":1896,"asi":{"finding":"fullyParallel:true breaks describe.serial files (backy/xray/webhook/etc rely on shared state across tests). 6 failures.","hypothesis":"fullyParallel:true to parallelize tests, not just files","rollback_reason":"Breaks describe.serial-dependent specs."}}
{"run":51,"commit":"7cef262","metric":56.72,"metrics":{"l2_s":15.39,"l3_failed":0,"l3_s":40.84,"worker_s":0.49},"status":"keep","description":"Split tags-create.spec — 'assign existing' to its own file","timestamp":1776652991069,"segment":3,"confidence":17.38429752066112,"iterationTokens":4828,"asi":{"finding":"Splitting tags-create's longest test (8s 'assign existing') into its own file: L3 42.8→40.8s. New bottleneck likely link-crud or backy.","hypothesis":"Split tags-create's slowest test into its own file"}}
{"run":52,"commit":"4b77177","metric":55.07,"metrics":{"l2_s":14.93,"l3_failed":0,"l3_s":39.63,"worker_s":0.51},"status":"keep","description":"link-crud view-and-interact group describe.parallel","timestamp":1776653131487,"segment":3,"confidence":16.68702290076333,"iterationTokens":2781,"asi":{"finding":"link-crud view-and-interact group describe.parallel: L3 40.8→39.6s, total 55s. Marginal but consistent.","hypothesis":"describe.parallel inside link-crud's view-and-interact group (5 independent tests with own seed)"}}
{"run":53,"commit":"4b77177","metric":58.47,"metrics":{"l2_s":17.2,"l3_failed":0,"l3_s":40.8,"worker_s":0.47},"status":"discard","description":"tags-create parallel for remaining tests","timestamp":1776653212140,"segment":3,"confidence":18.14107883817425,"iterationTokens":1509,"asi":{"finding":"tags-create parallel: L3 39.6→40.8s. Increased L2 to 17s likely noise. Net worse than baseline (58.5 vs 55).","hypothesis":"tags-create describe.parallel for the 3 remaining tests","rollback_reason":"Slightly worse — L2 noise + no L3 win."}}
{"run":54,"commit":"4b77177","metric":56.07,"metrics":{"l2_s":16.09,"l3_failed":0,"l3_s":39.49,"worker_s":0.49},"status":"discard","description":"navigation describe.parallel","timestamp":1776653288863,"segment":3,"confidence":18.44725738396621,"iterationTokens":2825,"asi":{"finding":"navigation parallel: barely moved (39.6→39.5s). Bench dominated by tags-create/backy now. Within noise on total.","hypothesis":"navigation describe.parallel for 13 independent tests"}}
{"run":55,"commit":"4b77177","metric":58.21,"metrics":{"l2_s":16.44,"l3_failed":0,"l3_s":41.19,"worker_s":0.58},"status":"discard","description":"workers=10 (worse)","timestamp":1776653360588,"segment":3,"confidence":19.561521252796396,"iterationTokens":1438,"asi":{"finding":"workers=10: 41.2s vs 39.6s baseline. Hit diminishing returns; CPU/dev-server saturated.","hypothesis":"workers=10","rollback_reason":"Worse than workers=8."}}
{"run":56,"commit":"4b77177","metric":56.45,"metrics":{"l2_s":15.49,"l3_failed":0,"l3_s":40.48,"worker_s":0.48},"status":"discard","description":"describe.concurrent Authentication in folders","timestamp":1776653465320,"segment":3,"confidence":20.81904761904761,"iterationTokens":6668,"asi":{"finding":"Marginal noise. Only 2 tests, savings ~1s if they ran in parallel — but maxConcurrency or D1 round-trip latency dominates anyway.","hypothesis":"describe.concurrent on Authentication block (2 read-only tests)","rollback_reason":"No measurable improvement."}}
{"run":57,"commit":"4b77177","metric":57.71,"metrics":{"l2_s":14.99,"l3_failed":0,"l3_s":42.24,"worker_s":0.48},"status":"discard","description":"Backy split push/pull (no win)","timestamp":1776653671286,"segment":3,"confidence":18.68376068376069,"iterationTokens":644,"asi":{"finding":"Backy split into push+pull files: 56-58s, 113 passed. Within noise (vs 55s best). Structural improvement (cleaner separation) but no measurable wall-time gain. Discarding to keep history clean.","hypothesis":"Split backy.spec into push + pull (independent state)","rollback_reason":"No measurable improvement (~noise). Functionally clean refactor but doesn't move the bench."}}
{"run":58,"commit":"79808d0","metric":55.47,"metrics":{"l2_s":16.15,"l3_failed":0,"l3_s":38.8,"worker_s":0.52},"status":"keep","description":"L2 health-poll 1000ms→100ms","timestamp":1776653779527,"segment":3,"confidence":15.89818181818182,"iterationTokens":3567,"asi":{"finding":"Within noise (55.5 vs 55.07 best). Health-poll improvement is real but small; cleanup commit kept for future.","hypothesis":"Reduce L2 health poll interval 1000→100ms (saves up to 1s startup)"}}
{"run":59,"commit":"79808d0","metric":57.58,"metrics":{"l2_s":15.51,"l3_failed":0,"l3_s":41.59,"worker_s":0.48},"status":"discard","description":"Pre-warm subroutes via request.get parallel (worse)","timestamp":1776653876629,"segment":3,"confidence":18.967462039045557,"iterationTokens":2431,"asi":{"finding":"Pre-warm via request.get: 41.6s vs 38.8s baseline. Adds setup cost not amortized; possibly request.get doesn't compile client bundle.","hypothesis":"Pre-warm dashboard subroutes in parallel via request.get","rollback_reason":"Net worse (57.6 vs 55.5)."}}
{"run":60,"commit":"79808d0","metric":57.24,"metrics":{"l2_s":16.55,"l3_failed":0,"l3_s":40.13,"worker_s":0.56},"status":"discard","description":"L2 spawn vitest directly","timestamp":1776653983220,"segment":3,"confidence":19.963470319634727,"iterationTokens":6281,"asi":{"finding":"Within noise. bun spawn directly vs bun x — negligible difference.","hypothesis":"Skip 'bun x' wrapper for vitest (faster spawn)","rollback_reason":"No measurable improvement."}}
{"run":61,"commit":"a6df48f","metric":56.17,"metrics":{"l2_s":15.22,"l3_failed":0,"l3_s":40.42,"worker_s":0.53},"status":"keep","description":"Split folders.test.ts into folders + folders-by-id (L2)","timestamp":1776654095278,"segment":3,"confidence":18.254697286012533,"iterationTokens":6846,"asi":{"finding":"Split folders.test.ts into folders + folders-by-id. Per-file users isolate cleanup. L2 floor moved from folders(14s) to links(13s). 197+ tests pass.","hypothesis":"Split folders.test.ts (was longest L2 file) into folders + folders-by-id"}}
{"run":62,"commit":"a6df48f","metric":56.37,"metrics":{"l2_s":15.25,"l3_failed":0,"l3_s":40.6,"worker_s":0.52},"status":"discard","description":"Split tags.test.ts (no measurable win)","timestamp":1776654218266,"segment":3,"confidence":16.81538461538461,"iterationTokens":6094,"asi":{"finding":"Within noise. tags split didn't move L2 because links is now the longest at 13s. Cleaner code structure though.","hypothesis":"Split tags.test.ts into tags + tags-by-id","rollback_reason":"No measurable improvement (noise)."}}
{"run":63,"commit":"a6df48f","metric":59.27,"metrics":{"l2_s":14.73,"l3_failed":0,"l3_s":44.04,"worker_s":0.5},"status":"discard","description":"navigation describe.parallel (worse)","timestamp":1776654368560,"segment":3,"confidence":18.885529157667378,"iterationTokens":3595,"asi":{"finding":"navigation parallel: L3 went UP to 44s. With workers=8 saturated by long files, parallelizing navigation's 13 short tests just creates contention.","hypothesis":"navigation describe.parallel","rollback_reason":"Worse (44s vs 40s baseline)."}}
{"run":64,"commit":"a6df48f","metric":55.55,"metrics":{"l2_s":14.85,"l3_failed":0,"l3_s":40.18,"worker_s":0.52},"status":"discard","description":"workers=7 (no win)","timestamp":1776654438153,"segment":3,"confidence":17.14509803921566,"iterationTokens":1439,"asi":{"finding":"workers=7: 40.2s vs 40.4s. Within noise.","hypothesis":"workers=7 may be optimum (less contention)","rollback_reason":"No measurable improvement."}}
{"run":65,"commit":"5591df9","metric":55.02,"metrics":{"l2_s":14.61,"l3_failed":0,"l3_s":39.92,"worker_s":0.49},"status":"keep","description":"Split links.test.ts into links + links-post (L2)","timestamp":1776654577590,"segment":3,"confidence":16.932301740812374,"iterationTokens":7011,"asi":{"finding":"Split links.test.ts into links + links-post (for POST + RateLimit). L2 floor 12.3→11.5s ish. New best 55.02s.","hypothesis":"Split links.test.ts into links (GET + Auth) + links-post (POST + RateLimit)"}}
{"run":66,"commit":"4f014a1","metric":53.88,"metrics":{"l2_s":14.88,"l3_failed":0,"l3_s":38.51,"worker_s":0.49},"status":"keep","description":"Migrate root L2 files to resetAndSeedUser (1 round trip)","timestamp":1776654696877,"segment":3,"confidence":17.14122137404582,"iterationTokens":7003,"asi":{"finding":"Migrated remaining root L2 files (api, backy-pull, tmp-upload, webhook, webhook-invalidation) to resetAndSeedUser. New best 53.88s.","hypothesis":"Migrate remaining cleanupTestData+seedTestUser pairs to resetAndSeedUser"}}
{"run":67,"commit":"4f014a1","metric":57.46,"metrics":{"l2_s":14.19,"l3_failed":0,"l3_s":42.68,"worker_s":0.59},"status":"discard","description":"Split webhook.test.ts (L2 win masked by L3 noise)","timestamp":1776654890221,"segment":3,"confidence":18.256097560975604,"iterationTokens":656,"asi":{"finding":"Webhook split: L2 floor dropped 14.9→14.2s consistently. L3 had a 4s noise jump in this run that masked the win. Total 57.5-58s vs best 53.88s.","hypothesis":"Split webhook.test.ts (HEAD/GET vs POST) to relieve L2 longest file (11s)","rollback_reason":"L3 noise variance pushed total above best. L2 improvement is real but masked."}}
{"run":68,"commit":"4f014a1","metric":0,"metrics":{"worker_s":0,"l2_s":0,"l3_s":0,"l3_failed":0},"status":"crash","description":"Re-apply webhook split (interrupted)","timestamp":1776661406783,"segment":3,"confidence":18.256097560975604,"iterationTokens":3427,"asi":{"finding":"Bench was interrupted by context window. Retrying.","hypothesis":"Webhook split lowers L2 floor"}}
{"type":"config","name":"Optimize L1 unit test execution speed (keep coverage ≥95%)","metricName":"unit_cov_s","metricUnit":"s","bestDirection":"lower"}
{"run":69,"commit":"4c03d7f","metric":5.59,"metrics":{"unit_s":4.97,"cov_lines":99.33,"cov_statements":98.26,"cov_branches":92.6,"cov_functions":98.16},"status":"keep","description":"Baseline: L1 unit test wall-clock with coverage","timestamp":1776722733477,"segment":4,"confidence":null,"iterationTokens":4932,"asi":{"hypothesis":"Establish baseline for L1 unit tests with coverage","baseline_total_s":5.59,"test_files":95,"tests":2401,"thresholds":"lines:95 functions:90 branches:85 statements:95","bottleneck_hint":"vitest reports 'tests 15.84s' inside test runner — heavy parallelism inside; environment 30s suggests jsdom setup is slow"}}
{"run":70,"commit":"0157361","metric":4.48,"metrics":{"cov_branches":92.55,"cov_functions":98.16,"cov_lines":99.33,"cov_statements":98.26,"unit_s":3.8},"status":"keep","description":"Mark 49 pure-Node unit test files with @vitest-environment node","timestamp":1776722841559,"segment":4,"confidence":null,"iterationTokens":23112,"asi":{"approach":"Add `// @vitest-environment node` directive to 49 unit test files that don't touch DOM. Guarded jsdom Element polyfill in tests/setup.ts so it's safe in node env.","files_node":49,"files_total":95,"hypothesis":"Run pure-Node unit tests in node env instead of jsdom — jsdom setup is the dominant per-worker overhead","next_idea":"Try removing default jsdom env entirely; component tests in tests/components also use jsdom but already have it. Could speed up further."}}
{"run":71,"commit":"0157361","metric":4.43,"metrics":{"cov_branches":92.55,"cov_functions":98.16,"cov_lines":99.33,"cov_statements":98.26,"unit_s":3.73},"status":"keep","description":"Default vitest env to node; mark 44 DOM-using tests jsdom","timestamp":1776722882299,"segment":4,"confidence":23.199999999999672,"iterationTokens":2497,"asi":{"all_tests_passed":"95/95 files, 2401/2401 tests","approach":"Set vitest default env to 'node'. Mark 44 DOM-using files (component tests + viewmodel tests) with `@vitest-environment jsdom`.","hypothesis":"Default environment to 'node' (correctness improvement); jsdom only opt-in. Removes any future test from accidentally getting jsdom for free."}}
{"run":72,"commit":"febfc00","metric":4.25,"metrics":{"cov_branches":92.55,"cov_functions":98.16,"cov_lines":99.33,"cov_statements":98.26,"unit_s":3.23},"status":"keep","description":"Switch vitest pool to threads (faster than forks)","timestamp":1776722940436,"segment":4,"confidence":11.652173913043455,"iterationTokens":6649,"asi":{"approach":"pool: threads (instead of default forks). Lower process startup overhead since threads share node initialization.","hypothesis":"thread pool reduces fork startup overhead","test_files_passed":"95/95"}}
{"run":73,"commit":"4c04868","metric":4.12,"metrics":{"cov_branches":92.55,"cov_functions":98.16,"cov_lines":99.33,"cov_statements":98.26,"unit_s":3.15},"status":"keep","description":"Use top-level isolate (vitest 4 migration) — pool=threads","timestamp":1776722982560,"segment":4,"confidence":8.166666666666679,"iterationTokens":2292,"asi":{"approach":"Vitest 4 removed poolOptions — promote isolate to top-level. Confirms threads pool perf.","hypothesis":"Cleanup deprecated config; verify pool=threads still beats forks"}}
{"run":74,"commit":"4c04868","metric":3.78,"metrics":{"cov_branches":0,"cov_functions":0,"cov_lines":0,"cov_statements":0,"unit_s":2.68},"status":"discard","description":"isolate: false (72 component test failures)","timestamp":1776723014295,"segment":4,"confidence":8.166666666666657,"iterationTokens":1584,"asi":{"failures":72,"hypothesis":"isolate: false to share module graph between tests in same worker","rollback_reason":"Component tests share React module instances and break (cleanup() side effects, module-level mocks)."}}
