{"run":106,"commit":"5d176d8","metric":4.48,"metrics":{"cov_branches":92.55,"cov_functions":98.16,"cov_lines":99.33,"cov_statements":98.26,"unit_s":3.5},"status":"discard","description":"coverage.reporter=['text-summary']","timestamp":1776726797039,"segment":4,"confidence":7.142857142857144,"iterationTokens":2615,"asi":{"hypothesis":"coverage.reporter=['text-summary'] (instead of ['text','json','html']) to skip per-file table rendering","measurements_5":"4.42, 4.44, 4.48, 4.61, 4.67","median":4.48,"rollback_reason":"Worse than 4.20 baseline. Bench script adds additional reporters which override; or the change doesn't improve the hot path."}}
{"run":107,"commit":"cb2dc77","metric":4.07,"metrics":{"cov_branches":92.55,"cov_functions":98.16,"cov_lines":99.33,"cov_statements":98.26,"unit_s":3.5},"status":"keep","description":"esbuild target=esnext + legalComments=none in vitest config","timestamp":1776726885736,"segment":4,"confidence":6.909090909090915,"iterationTokens":415,"asi":{"hypothesis":"esbuild { target: 'esnext', legalComments: 'none' } — skip down-leveling and license-comment processing during transform","measurements_8":"3.92, 3.94, 4.02, 4.05, 4.08, 4.21, 4.22, 4.27","median":4.07,"next_action_hint":"Coverage v8 + jsdom worker pool likely the floor. Could try playing with jsdom env setup file split via projects."}}
{"run":108,"commit":"c27a7b4","metric":3.71,"metrics":{"cov_branches":92.55,"cov_functions":98.16,"cov_lines":99.33,"cov_statements":98.26,"unit_s":2.95},"status":"keep","description":"Switch jsdom -> happy-dom (47 files) + clipboard polyfill","timestamp":1776727035335,"segment":4,"confidence":8.355555555555553,"iterationTokens":371,"asi":{"current_run":3.64,"hypothesis":"Switch jsdom -> happy-dom (47 test files updated). happy-dom is significantly faster to bootstrap.","measurements_5":"3.64, 3.68, 3.71, 3.74, 3.75","median_5":3.71,"next_action_hint":"Further wins from coverage tweaks; or split projects (happy-dom for components, node for unit) is now native split.","per_file_aggregate":"environment 10.2s -> 7.27s aggregate (-29%); wall ~9% improvement","polyfill_added":"navigator.clipboard polyfill in tests/setup.ts (happy-dom defines it as non-configurable getter that breaks Object.assign)"}}
{"run":109,"commit":"71bf632","metric":3.68,"metrics":{"cov_branches":92.55,"cov_functions":98.16,"cov_lines":99.33,"cov_statements":98.26,"unit_s":2.95},"status":"keep","description":"Remove unused jsdom devDep","timestamp":1776727099708,"segment":4,"confidence":8.30434782608694,"iterationTokens":2477,"asi":{"hypothesis":"Remove unused jsdom devDep (no longer referenced after happy-dom switch)","measurements_5":"3.66, 3.67, 3.68, 3.75, 3.87","median":3.68,"next_action_hint":"Look at coverage v8 overhead next or reduce environment setup further with happy-dom config tuning."}}
{"run":110,"commit":"71bf632","metric":3.79,"metrics":{"cov_branches":92.55,"cov_functions":98.16,"cov_lines":99.33,"cov_statements":98.26,"unit_s":2.95},"status":"discard","description":"happy-dom environmentOptions (disable JS eval / CSS / styles / error capture)","timestamp":1776727234895,"segment":4,"confidence":7.639999999999999,"iterationTokens":1879,"asi":{"hypothesis":"happy-dom environmentOptions: disable JS evaluation, CSS, computed styles, error capturing","measurements_5":"3.62, 3.72, 3.85, 3.96, 62.49 (1 hang/flake)","median_4":3.79,"rollback_reason":"Caused intermittent ERR_VM_MODULE_LINK_FAILURE flakes (62s hang in run #5). disableJavaScriptEvaluation likely interferes with module loading. Median of 4 successful runs is also no better than 3.68."}}
{"run":111,"commit":"71bf632","metric":4.04,"metrics":{"cov_branches":92.55,"cov_functions":98.16,"cov_lines":99.33,"cov_statements":98.26,"unit_s":0},"status":"discard","description":"pool: 'forks' instead of 'threads'","timestamp":1776727491399,"segment":4,"confidence":7.074074074074084,"iterationTokens":1022,"asi":{"hypothesis":"Try forks pool to see if process isolation reduces happy-dom contention","measurements_3":"4.04, 4.06, 4.12","median":4.04,"rollback_reason":"Worse than threads (4.04 vs 3.68). Fork startup is heavier than thread startup; happy-dom doesn't suffer from thread races."}}
{"run":112,"commit":"72e1c82","metric":2.92,"metrics":{"cov_branches":92.64,"cov_functions":98.16,"cov_lines":99.33,"cov_statements":98.26,"unit_s":2.17},"status":"keep","description":"pool: 'vmThreads' instead of 'threads'","timestamp":1776727617854,"segment":4,"confidence":9.709090909090913,"iterationTokens":460,"asi":{"hypothesis":"Switch pool from 'threads' to 'vmThreads' — uses Node VM contexts for isolation instead of full worker_threads, which has lower per-file startup cost","measurements_5":"2.91, 2.92, 2.92, 2.97, 2.98","median_5":2.92,"next_action_hint":"vmThreads is the new floor. Per-file timings significantly reduced — confirm by inspecting top files. Try happy-dom env tweaks now that pool changed.","tests_pass":"97 files / 2401 tests, all green; coverage thresholds met (lines 99.33%, statements 98.26%)","win_size":"0.76s median, ~21% wall reduction"}}
{"run":113,"commit":"0204072","metric":3.05,"metrics":{"unit_s":2.78,"cov_lines":99.33,"cov_statements":98.28,"cov_branches":92.84,"cov_functions":98.16},"status":"keep","description":"Re-baseline at HEAD (single trial)","timestamp":1777152921167,"segment":4,"confidence":9.206896551724137,"iterationTokens":460,"asi":{"hypothesis":"Establish current baseline at HEAD with new test additions since #112"}}
{"run":114,"commit":"0204072","metric":3.32,"metrics":{"cov_branches":92.84,"cov_functions":98.16,"cov_lines":99.33,"cov_statements":98.28,"unit_s":2.78},"status":"discard","description":"Baseline at HEAD (5 trials)","timestamp":1777153039748,"segment":4,"confidence":9.709090909090897,"iterationTokens":661,"asi":{"hypothesis":"Re-baseline (5 trials) since previous single 3.05 was lucky","measurements_5":"3.25, 3.32, 3.32, 3.39, 3.53","median":3.32}}
{"run":115,"commit":"34842b5","metric":3.02,"metrics":{"cov_branches":92.84,"cov_functions":98.16,"cov_lines":99.33,"cov_statements":98.28,"unit_s":2.26},"status":"keep","description":"Lazy-load jest-dom matchers only in DOM env","timestamp":1777153217083,"segment":4,"confidence":9.888888888888903,"iterationTokens":1893,"asi":{"hypothesis":"Lazy-load @testing-library/jest-dom/vitest only in DOM env (skip ~50 node-env files)","measurements_change_7":"2.91, 3.01, 3.02, 3.02, 3.05, 3.05, 3.26","median_change":3.02,"measurements_baseline_5":"3.35, 3.37, 3.67, 3.86, 3.86","median_baseline":3.67,"delta":"-0.65s (-18%)","next_action_hint":"Try moving DOM-only polyfills (ResizeObserver, clipboard, Element prototype) behind same gate"}}
{"run":116,"commit":"34842b5","metric":3.72,"metrics":{"cov_branches":92.84,"cov_functions":98.16,"cov_lines":99.33,"cov_statements":98.28,"unit_s":2.68},"status":"discard","description":"vmThreads.memoryLimit=0.5","timestamp":1777153288855,"segment":4,"confidence":10.269230769230795,"iterationTokens":2963,"asi":{"hypothesis":"vmThreads memoryLimit=0.5 to recycle workers and reduce variance","measurements_5":"2.92, 3.38, 3.72, 3.73, 4.5","median":3.72,"rollback_reason":"Worse and higher variance vs 3.02 baseline. Recycling adds startup cost more than it gains."}}
{"run":117,"commit":"34842b5","metric":3.04,"metrics":{"cov_branches":92.84,"cov_functions":98.16,"cov_lines":99.33,"cov_statements":98.28,"unit_s":2.26},"status":"discard","description":"Add { interval: 5 } to remaining 13 vi.waitFor sites","timestamp":1777153472521,"segment":4,"confidence":10.68,"iterationTokens":913,"asi":{"hypothesis":"Add { interval: 5 } to remaining 13 vi.waitFor sites in 5 files","measurements_12":"2.9, 2.95, 2.96, 3.0, 3.01, 3.01, 3.07, 3.20, 3.35, 4.0, 4.04, 4.7","median":3.04,"rollback_reason":"Within noise vs 3.02 baseline. The 13 waitFor sites are mostly successful immediately on first poll, so 50ms→5ms interval doesn't help. Tests still pass — keeping change is harmless but not a perf win."}}
{"run":118,"commit":"34842b5","metric":3.14,"metrics":{"cov_branches":92.84,"cov_functions":98.16,"cov_lines":99.33,"cov_statements":98.28,"unit_s":2.3},"status":"discard","description":"server.deps.inline=['cmdk']","timestamp":1777153612155,"segment":4,"confidence":10.470588235294121,"iterationTokens":794,"asi":{"hypothesis":"Pre-bundle cmdk via server.deps.inline for vmThread contexts","measurements_12":"2.79, 2.91, 2.96, 3.02, 3.05, 3.10, 3.17, 3.22, 3.92, 4.05, 4.09, 4.14","median":3.135,"rollback_reason":"Within noise / slightly worse vs 3.02 baseline. cmdk inline bundling may add transform cost without payoff."}}
{"run":119,"commit":"230c05a","metric":2.88,"metrics":{"cov_branches":92.84,"cov_functions":98.16,"cov_lines":99.33,"cov_statements":98.28,"unit_s":2.15},"status":"keep","description":"deps.optimizer.web with React/RTL pre-bundle","timestamp":1777153776683,"segment":4,"confidence":10.423076923076932,"iterationTokens":799,"asi":{"delta":"-0.14s (-5%)","hypothesis":"Enable deps.optimizer.web with React/RTL pre-bundling for vmThread contexts","lower_bound_improved":"2.82s vs 2.91s prev best","measurements_12":"2.82, 2.83, 2.84, 2.86, 2.87, 2.87, 2.89, 2.92, 3.01, 3.10, 3.46, 3.53","median":2.88}}
{"run":120,"commit":"230c05a","metric":3.37,"metrics":{"cov_branches":92.84,"cov_functions":98.16,"cov_lines":99.33,"cov_statements":98.28,"unit_s":2.5},"status":"discard","description":"Expand optimizer.web.include (cmdk, @testing-library/dom)","timestamp":1777153845470,"segment":4,"confidence":10.42307692307695,"iterationTokens":2431,"asi":{"hypothesis":"Add cmdk + @testing-library/dom to optimizer.web.include","measurements_7":"3.04, 3.12, 3.18, 3.37, 3.95, 4.15, 4.35","median":3.37,"rollback_reason":"Worse than 2.88. cmdk pre-bundle increases optimizer cost without payoff. @testing-library/dom may have circular issues."}}
{"run":121,"commit":"230c05a","metric":3.4,"metrics":{"cov_branches":92.84,"cov_functions":98.16,"cov_lines":99.33,"cov_statements":98.28,"unit_s":2.5},"status":"discard","description":"Add ssr optimizer (next-auth, @auth/core)","timestamp":1777153905978,"segment":4,"confidence":10.423076923076932,"iterationTokens":1691,"asi":{"hypothesis":"Add ssr.optimizer for next-auth/@auth/core","measurements_7":"2.65, 2.7, 2.74, 3.4, 3.5, 3.73, 4.45","median":3.4,"rollback_reason":"Worse median 3.4 vs 2.88 baseline. ssr pre-bundle of auth packages adds startup cost; node tests don't import them often enough to amortize."}}
{"run":122,"commit":"230c05a","metric":3.14,"metrics":{"cov_branches":92.84,"cov_functions":98.16,"cov_lines":99.33,"cov_statements":98.28,"unit_s":2.5},"status":"discard","description":"Add lucide-react to optimizer.web","timestamp":1777153978757,"segment":4,"confidence":8.741935483870966,"iterationTokens":3880,"asi":{"hypothesis":"Add lucide-react to optimizer.web.include","measurements_7":"2.98, 3.01, 3.02, 3.14, 3.14, 3.15, 3.23","median":3.14,"rollback_reason":"Worse than 2.88 baseline. lucide-react is large (1000+ icon files); pre-bundling it adds optimizer overhead larger than the saved per-file resolve."}}
{"run":123,"commit":"230c05a","metric":3.18,"metrics":{"cov_branches":92.84,"cov_functions":98.16,"cov_lines":99.33,"cov_statements":98.28,"unit_s":2.24},"status":"discard","description":"isolate: false (shared vmThread contexts)","timestamp":1777154072588,"segment":4,"confidence":7.324324324324322,"iterationTokens":725,"asi":{"hypothesis":"Set isolate=false for vmThreads to share contexts between test files","measurements_8":"3.0, 3.02, 3.07, 3.16, 3.20, 4.13, 4.17, 4.53","median":3.18,"rollback_reason":"Worse median 3.18 vs 2.88, much higher variance (3 outliers >4s). Even though tests pass, shared context introduces module-cache state pollution that slows hot files.","tests_pass":true}}
{"run":124,"commit":"230c05a","metric":3.03,"metrics":{"cov_branches":92.84,"cov_functions":98.16,"cov_lines":99.33,"cov_statements":98.28,"unit_s":2.5},"status":"discard","description":"Add react/jsx-runtime to optimizer.web","timestamp":1777154165903,"segment":4,"confidence":6.530120481927703,"iterationTokens":4936,"asi":{"hypothesis":"Add react/jsx-runtime to optimizer.web.include","measurements_7":"2.89, 2.94, 2.97, 3.03, 3.04, 3.06, 3.08","median":3.03,"rollback_reason":"Slightly worse than 2.88. jsx-runtime probably already inlined by plugin-react."}}
{"run":125,"commit":"230c05a","metric":4.9,"metrics":{"cov_branches":92.84,"cov_functions":98.16,"cov_lines":99.33,"cov_statements":98.28,"unit_s":4},"status":"discard","description":"Drop 'react-dom' from optimizer (keep client only)","timestamp":1777154243055,"segment":4,"confidence":6.452380952380953,"iterationTokens":1458,"asi":{"hypothesis":"Remove 'react-dom' (keep client subpath only)","measurements_7":"3.87, 4.01, 4.22, 4.9, 5.0, 5.29, 5.33","median":4.9,"rollback_reason":"Significantly worse. react-dom/server and other entry paths may need pre-bundle too."}}
{"run":126,"commit":"230c05a","metric":2.99,"metrics":{"cov_branches":92.84,"cov_functions":98.16,"cov_lines":99.33,"cov_statements":98.28,"unit_s":2.4},"status":"discard","description":"vmThreads minThreads=4 maxThreads=8","timestamp":1777154326566,"segment":4,"confidence":6.089887640449434,"iterationTokens":3236,"asi":{"hypothesis":"Cap maxThreads=8 (half of 16 CPUs) and pre-warm with minThreads=4","measurements_7":"2.96, 2.96, 2.98, 2.99, 3.04, 3.07, 3.08","median":2.99,"rollback_reason":"Slightly worse median 2.99 vs 2.88 — but variance much lower. Trade-off not worth it for primary metric."}}
{"run":127,"commit":"230c05a","metric":3.18,"metrics":{"cov_branches":92.84,"cov_functions":98.16,"cov_lines":99.33,"cov_statements":98.28,"unit_s":2.4},"status":"discard","description":"vmThreads minThreads=4","timestamp":1777154380012,"segment":4,"confidence":5.891304347826087,"iterationTokens":1600,"asi":{"hypothesis":"minThreads=4 to pre-warm thread pool","measurements_7":"2.94, 3.01, 3.09, 3.18, 3.18, 3.20, 3.40","median":3.18,"rollback_reason":"Worse than 2.88. Pre-warm overhead exceeds savings; default min=1 dynamic ramp-up is better."}}
{"run":128,"commit":"230c05a","metric":3.76,"metrics":{"cov_branches":92.84,"cov_functions":98.16,"cov_lines":99.33,"cov_statements":98.28,"unit_s":2.5},"status":"discard","description":"server.deps.fallbackCJS=true","timestamp":1777154469747,"segment":4,"confidence":5.827956989247311,"iterationTokens":2874,"asi":{"hypothesis":"server.deps.fallbackCJS for faster CJS handling","measurements_7":"3.12, 3.29, 3.68, 3.76, 3.9, 4.19, 4.4","median":3.76,"rollback_reason":"Significantly worse. fallbackCJS adds processing for CJS path and may interfere with optimizer."}}
{"run":129,"commit":"230c05a","metric":3.22,"metrics":{"cov_branches":92.84,"cov_functions":98.16,"cov_lines":99.33,"cov_statements":98.28,"unit_s":2.5},"status":"discard","description":"noDiscovery + holdUntilCrawlEnd=false","timestamp":1777154536266,"segment":4,"confidence":5.765957446808514,"iterationTokens":2452,"asi":{"hypothesis":"noDiscovery + holdUntilCrawlEnd:false to skip auto-discovery of deps","measurements_7":"3.01, 3.04, 3.07, 3.22, 3.23, 3.26, 3.27","median":3.22,"rollback_reason":"Worse than 2.88. With noDiscovery, vite skips finding additional deps to optimize — hurts when something not in include is needed."}}
{"run":130,"commit":"230c05a","metric":2.99,"metrics":{"cov_branches":92.84,"cov_functions":98.16,"cov_lines":99.33,"cov_statements":98.28,"unit_s":2.5},"status":"discard","description":"holdUntilCrawlEnd=false","timestamp":1777154588057,"segment":4,"confidence":5.705263157894741,"iterationTokens":1480,"asi":{"hypothesis":"holdUntilCrawlEnd:false to start running tests sooner","measurements_7":"2.89, 2.89, 2.89, 2.99, 2.99, 3.11, 3.15","median":2.99,"rollback_reason":"Slightly worse 2.99 vs 2.88. Earlier-start of tests doesn't outweigh additional re-bundling triggers when new deps discovered mid-run."}}
{"run":131,"commit":"230c05a","metric":3.63,"metrics":{"cov_branches":92.84,"cov_functions":98.16,"cov_lines":99.33,"cov_statements":98.28,"unit_s":2.5},"status":"discard","description":"pool=threads + optimizer.web","timestamp":1777154652528,"segment":4,"confidence":5.765957446808514,"iterationTokens":1480,"asi":{"hypothesis":"Switch to pool=threads with optimizer.web","measurements_7":"3.53, 3.55, 3.57, 3.63, 3.84, 3.9, 4.36","median":3.63,"rollback_reason":"vmThreads still wins. Even with optimizer.web pre-bundle, full worker_threads have higher startup cost than VM contexts."}}
{"run":132,"commit":"2cce664","metric":3.17,"metrics":{"cov_branches":92.84,"cov_functions":98.16,"cov_lines":99.33,"cov_statements":98.28,"unit_s":2.5},"status":"discard","description":"Extract d1 mock factory body to tests/mocks/d1-client-mock.ts","timestamp":1777154831333,"segment":4,"confidence":5.765957446808511,"iterationTokens":9872,"asi":{"factory_size_kb":50,"hypothesis":"Extract 1618-line d1 mock factory body to tests/mocks/d1-client-mock.ts (setup.ts shrinks from 1695 → 82 lines)","measurements_7":"2.90, 3.02, 3.10, 3.17, 3.70, 3.95, 4.05","median":3.17,"rollback_reason":"Worse than 2.88 baseline + higher variance (3 outliers >3.7s). Confirms idea #94 finding: factory body transform is amortized per-worker, and now the additional module resolution + Link type import incurs extra transform per file. setup.ts shrinking doesn't help."}}
{"run":133,"commit":"230c05a","metric":2.93,"metrics":{"cov_branches":92.84,"cov_functions":98.16,"cov_lines":99.33,"cov_statements":98.28,"unit_s":2.5},"status":"discard","description":"Add @radix-ui/react-dialog to optimizer.web","timestamp":1777154934372,"segment":4,"confidence":6.0222222222222195,"iterationTokens":453,"asi":{"hypothesis":"Add @radix-ui/react-dialog to optimizer.web.include","measurements_14":"2.81, 2.81, 2.85, 2.86, 2.87, 2.88, 2.92, 2.94, 2.94, 2.95, 2.96, 3.01, 3.69, 3.81","median":2.93,"rollback_reason":"Within noise of 2.88 baseline. radix dialog is hardly used directly by tests."}}
{"run":134,"commit":"230c05a","metric":3.07,"metrics":{"cov_branches":92.84,"cov_functions":98.16,"cov_lines":99.33,"cov_statements":98.28,"unit_s":2.5},"status":"discard","description":"Expand optimizer.web.include (sonner, cva, clsx, twmerge)","timestamp":1777154990954,"segment":4,"confidence":6.022222222222228,"iterationTokens":1651,"asi":{"hypothesis":"Expand optimizer.web.include with sonner, class-variance-authority, clsx, tailwind-merge","measurements_7":"2.94, 2.95, 2.97, 3.07, 3.26, 4.17, 4.54","median":3.07,"rollback_reason":"Worse + more variance. Adding small utility libs to pre-bundle adds optimizer cold-start time without saving enough resolves."}}
{"run":135,"commit":"230c05a","metric":3.12,"metrics":{"cov_branches":92.84,"cov_functions":98.16,"cov_lines":99.33,"cov_statements":98.28,"unit_s":2.5},"status":"discard","description":"pool=vmForks","timestamp":1777155034392,"segment":4,"confidence":6.022222222222226,"iterationTokens":1468,"asi":{"hypothesis":"Switch to pool=vmForks (VM contexts in fork processes)","measurements_5":"3.02, 3.11, 3.12, 3.16, 3.23","median":3.12,"rollback_reason":"Worse than vmThreads 2.88. Fork startup heavier than thread startup, even with VM context isolation."}}
{"run":136,"commit":"230c05a","metric":3.14,"metrics":{"cov_branches":92.84,"cov_functions":98.16,"cov_lines":99.33,"cov_statements":98.28,"unit_s":2.5},"status":"discard","description":"vmThreads.useAtomics=true","timestamp":1777155132138,"segment":4,"confidence":5.765957446808511,"iterationTokens":2558,"asi":{"hypothesis":"vmThreads.useAtomics:true on top of optimizer.web","measurements_10":"2.85, 2.89, 2.92, 2.99, 3.13, 3.14, 3.29, 3.33, 3.61, 4.18","median":3.135,"rollback_reason":"Worse median 3.14 vs 2.88. useAtomics adds sync overhead without payoff for our workload."}}
{"run":137,"commit":"230c05a","metric":3.11,"metrics":{"cov_branches":92.84,"cov_functions":98.16,"cov_lines":99.33,"cov_statements":98.28,"unit_s":2.5},"status":"discard","description":"coverage.cleanOnRerun=false","timestamp":1777155219808,"segment":4,"confidence":5.530612244897957,"iterationTokens":3720,"asi":{"hypothesis":"coverage.cleanOnRerun=false to skip cleanup phase","measurements_7":"2.88, 2.95, 3.0, 3.11, 3.13, 3.61, 3.7","median":3.11,"rollback_reason":"Worse than 2.88. cleanOnRerun is not on the hot path for single-run bench."}}
{"run":138,"commit":"230c05a","metric":2.99,"metrics":{"cov_branches":92.84,"cov_functions":98.16,"cov_lines":99.33,"cov_statements":98.28,"unit_s":2.5},"status":"discard","description":"coverage.processingConcurrency=1","timestamp":1777155278335,"segment":4,"confidence":5.262135922330096,"iterationTokens":1740,"asi":{"hypothesis":"coverage.processingConcurrency=1 to reduce contention","measurements_7":"2.93, 2.97, 2.98, 2.99, 3.02, 3.24, 4.08","median":2.99,"rollback_reason":"Slightly worse 2.99 vs 2.88. Sequential coverage processing doesn't beat parallel for our file count."}}
{"run":139,"commit":"230c05a","metric":2.97,"metrics":{"cov_branches":92.84,"cov_functions":98.16,"cov_lines":99.33,"cov_statements":98.28,"unit_s":2.5},"status":"discard","description":"optimizer.web.exclude=lucide-react","timestamp":1777155376899,"segment":4,"confidence":4.927272727272729,"iterationTokens":454,"asi":{"hypothesis":"optimizer.web.exclude=['lucide-react'] to skip pre-bundling 1000+ icon files","measurements_14":"2.84, 2.90, 2.93, 2.94, 2.95, 2.96, 2.96, 2.97, 2.98, 2.99, 3.00, 3.03, 3.08, 3.08","median":2.965,"rollback_reason":"Median 2.965 worse than 2.88. But variance much tighter (range 2.84-3.08 vs baseline 2.82-3.53). Trade-off not worth speed regression.","variance_observation":"Very tight P90 (~3.05) suggests excluding lucide-react reduces optimizer-cache-miss outliers."}}
