{"run":140,"commit":"230c05a","metric":3.07,"metrics":{"cov_branches":92.84,"cov_functions":98.16,"cov_lines":99.33,"cov_statements":98.28,"unit_s":2.5},"status":"discard","description":"Add @testing-library/dom to optimizer.web","timestamp":1777155453504,"segment":4,"confidence":4.632478632478629,"iterationTokens":3316,"asi":{"hypothesis":"Add @testing-library/dom to optimizer.web.include (RTL re-exports it)","measurements_7":"2.9, 2.94, 3.07, 3.07, 3.17, 3.18, 3.23","median":3.07,"rollback_reason":"Worse than 2.88. testing-library/dom may have circular interaction with RTL's pre-bundle."}}
{"run":141,"commit":"230c05a","metric":4.84,"metrics":{"cov_branches":92.84,"cov_functions":98.16,"cov_lines":99.33,"cov_statements":98.28,"unit_s":2.5},"status":"discard","description":"test.maxWorkers=6 minWorkers=2","timestamp":1777155632434,"segment":4,"confidence":4.516666666666669,"iterationTokens":8181,"asi":{"hypothesis":"test.maxWorkers=6, minWorkers=2 to constrain parallelism","measurements_7":"4.1, 4.71, 4.8, 4.84, 4.84, 5.33, 6.0","median":4.84,"rollback_reason":"Catastrophic. Capping maxWorkers prevents vmThreads from scaling out for parallel file execution; suspect maxWorkers global override conflicts with pool sizing logic."}}
{"run":142,"commit":"230c05a","metric":4.34,"metrics":{"cov_branches":92.84,"cov_functions":98.16,"cov_lines":99.33,"cov_statements":98.28,"unit_s":2.5},"status":"discard","description":"pool=forks singleFork=true","timestamp":1777155672222,"segment":4,"confidence":4.754385964912282,"iterationTokens":1614,"asi":{"hypothesis":"pool=forks + singleFork=true to run all tests in one process","measurements_3":"4.29, 4.34, 4.47","median":4.34,"rollback_reason":"Single fork eliminates parallelism (~50% slower)."}}
{"run":143,"commit":"d0a0c9b","metric":2.88,"metrics":{"cov_branches":92.84,"cov_functions":98.16,"cov_lines":99.33,"cov_statements":98.28,"unit_s":2.16},"status":"discard","description":"Confirm final state at HEAD (3 trials)","timestamp":1777155755851,"segment":4,"confidence":4.516666666666669,"iterationTokens":4925,"asi":{"all_tests_pass":true,"coverage_lines":99.33,"hypothesis":"Confirm current HEAD state — 2 kept improvements (#115 lazy jest-dom, #119 deps.optimizer.web)","session_progression":"Session start ~3.67s → current best 2.88s (-21%)"}}
{"run":144,"commit":"f091c62","metric":2.87,"metrics":{"cov_branches":92.84,"cov_functions":98.16,"cov_lines":99.33,"cov_statements":98.28,"unit_s":2.21},"status":"keep","description":"Revert deps.optimizer.web (#119 was within noise; tighter variance without)","timestamp":1777156080933,"segment":4,"confidence":4.422764227642275,"iterationTokens":1004,"asi":{"delta_median":"-0.01s (within noise) but tighter P95","hypothesis":"Remove deps.optimizer.web (introduced in #119) — rerun shows it's no longer helping; cleared-cache A/B is marginal","measurements_21_clean":"2.79, 2.79, 2.79, 2.80, 2.81, 2.83, 2.85, 2.86, 2.86, 2.87, 2.87, 2.90, 2.93, 2.94, 2.94, 2.94, 2.96, 2.97, 3.01, 3.09","median":2.87,"p95_improved":"max 3.09 vs old 3.53 (−0.44s tail)","rationale":"Removing optimizer.web simplifies config and tightens variance for reliability. Median essentially tied with prior 2.88s baseline."}}
{"run":145,"commit":"f091c62","metric":2.61,"metrics":{"cov_branches":92.84,"cov_functions":98.16,"cov_lines":99.33,"cov_statements":98.28,"unit_s":2},"status":"keep","description":"deps.optimizer.ssr pre-bundle drizzle-orm","timestamp":1777156221034,"segment":4,"confidence":4.730158730158731,"iterationTokens":363,"asi":{"delta":"-0.26s (-9%)","hypothesis":"deps.optimizer.ssr enabled with include=['drizzle-orm'] — pre-bundle drizzle for node-env tests (most tests import lib/db/* which transitively pulls drizzle ORM)","measurements_21":"2.52, 2.55, 2.56, 2.56, 2.56, 2.59, 2.59, 2.60, 2.60, 2.61, 2.61, 2.62, 2.62, 2.63, 2.63, 2.64, 2.64, 2.65, 2.67, 2.75, 2.88","median":2.61,"p95":2.7,"rationale":"drizzle-orm has many small files; pre-bundling it once cuts per-file resolve time across ~50 node-env tests. Variance is extremely tight (range 2.52–2.88).","variance_max":2.88}}
